{
  "dependencies": [],
  "excluded_factors": [
    {
      "name": "VWAP0",
      "reason": "requires ungoverned $vwap column"
    }
  ],
  "factor_set": "alpha158",
  "factor_version": "2.0.0",
  "factors": [
    {
      "expression": "($close-$open)/$open",
      "implementation_fingerprint": "0cd5c30e5cd641147dee6d475d68383bdf9ab8059895ebe1719a0ae5d1b1232c",
      "minimum_history": 60,
      "name": "qlib_kmid",
      "qlib_name": "KMID",
      "version": "1.0.0"
    },
    {
      "expression": "($high-$low)/$open",
      "implementation_fingerprint": "5742d3e5c50c082788fcd62424bce38fbca024c861e7c3e4ad0d1c97ac7b045b",
      "minimum_history": 60,
      "name": "qlib_klen",
      "qlib_name": "KLEN",
      "version": "1.0.0"
    },
    {
      "expression": "($close-$open)/($high-$low+1e-12)",
      "implementation_fingerprint": "c688e4d88853a6761311f3821a82814e1291925f58b63168047f799ff65692fa",
      "minimum_history": 60,
      "name": "qlib_kmid2",
      "qlib_name": "KMID2",
      "version": "1.0.0"
    },
    {
      "expression": "($high-Greater($open, $close))/$open",
      "implementation_fingerprint": "fb913ebd56bfa173091b4889c84ac7353c350655127a0910177d5e542559ada5",
      "minimum_history": 60,
      "name": "qlib_kup",
      "qlib_name": "KUP",
      "version": "1.0.0"
    },
    {
      "expression": "($high-Greater($open, $close))/($high-$low+1e-12)",
      "implementation_fingerprint": "3049dface146472391e8d274d6189963c5a402c3307eca3b2fd8c4397ddeee18",
      "minimum_history": 60,
      "name": "qlib_kup2",
      "qlib_name": "KUP2",
      "version": "1.0.0"
    },
    {
      "expression": "(Less($open, $close)-$low)/$open",
      "implementation_fingerprint": "7f691980ad8f77c62ede4bfc5707bac7a06c932bc5c4c8d09e1448906361ae6b",
      "minimum_history": 60,
      "name": "qlib_klow",
      "qlib_name": "KLOW",
      "version": "1.0.0"
    },
    {
      "expression": "(Less($open, $close)-$low)/($high-$low+1e-12)",
      "implementation_fingerprint": "70bc43f48803e27f8735d73e64a68223ead1a0c99f1f8778bd34adf2df57be5c",
      "minimum_history": 60,
      "name": "qlib_klow2",
      "qlib_name": "KLOW2",
      "version": "1.0.0"
    },
    {
      "expression": "(2*$close-$high-$low)/$open",
      "implementation_fingerprint": "721cdcdae5ca75aea322b5467b55c316f1f99415fc5965b1cd8f3e6df7713136",
      "minimum_history": 60,
      "name": "qlib_ksft",
      "qlib_name": "KSFT",
      "version": "1.0.0"
    },
    {
      "expression": "(2*$close-$high-$low)/($high-$low+1e-12)",
      "implementation_fingerprint": "c6554be5e48caa39cfddff1dccc442cb5dd3e9513ceba4f00e1efae2498b627b",
      "minimum_history": 60,
      "name": "qlib_ksft2",
      "qlib_name": "KSFT2",
      "version": "1.0.0"
    },
    {
      "expression": "$open/$close",
      "implementation_fingerprint": "cf18877e154bcfaf2bb99e76095817bd8a6e8459e173152c0a60ec845fc29727",
      "minimum_history": 60,
      "name": "qlib_open0",
      "qlib_name": "OPEN0",
      "version": "1.0.0"
    },
    {
      "expression": "$high/$close",
      "implementation_fingerprint": "8910c3885cad373db24d43b7a758b8965198bc6ffe311e899116a3510c69c2a0",
      "minimum_history": 60,
      "name": "qlib_high0",
      "qlib_name": "HIGH0",
      "version": "1.0.0"
    },
    {
      "expression": "$low/$close",
      "implementation_fingerprint": "58104c22f3271c85cc0dd2bb8c82b6968461e91b116261754457f6ef27b8b62b",
      "minimum_history": 60,
      "name": "qlib_low0",
      "qlib_name": "LOW0",
      "version": "1.0.0"
    },
    {
      "expression": "Ref($close, 5)/$close",
      "implementation_fingerprint": "3982b85bc8590b00eb96c143d673d3b407639a14e9298b22dcc77162375ff41a",
      "minimum_history": 60,
      "name": "qlib_roc5",
      "qlib_name": "ROC5",
      "version": "1.0.0"
    },
    {
      "expression": "Ref($close, 10)/$close",
      "implementation_fingerprint": "36a7484a5d12249174866de1347d9ccc7aedb18f1c9661671aed0e69e61823dc",
      "minimum_history": 60,
      "name": "qlib_roc10",
      "qlib_name": "ROC10",
      "version": "1.0.0"
    },
    {
      "expression": "Ref($close, 20)/$close",
      "implementation_fingerprint": "578757550bbd5cd0b729dfe04850c1df418ce267949cda6a43387854c89f4738",
      "minimum_history": 60,
      "name": "qlib_roc20",
      "qlib_name": "ROC20",
      "version": "1.0.0"
    },
    {
      "expression": "Ref($close, 30)/$close",
      "implementation_fingerprint": "c68dcda6f85b0f518b89eb0146133807bf3ea15a01c82f58c2d8c1c7c9504488",
      "minimum_history": 60,
      "name": "qlib_roc30",
      "qlib_name": "ROC30",
      "version": "1.0.0"
    },
    {
      "expression": "Ref($close, 60)/$close",
      "implementation_fingerprint": "99a3d35fe48b83d23695d524127bcf250c00b61ca6e2a1ff9e70470154907c82",
      "minimum_history": 60,
      "name": "qlib_roc60",
      "qlib_name": "ROC60",
      "version": "1.0.0"
    },
    {
      "expression": "Mean($close, 5)/$close",
      "implementation_fingerprint": "3a36c978343296eedf7da378a673bf1bf95b11e97df2b333df7404f157e4133a",
      "minimum_history": 60,
      "name": "qlib_ma5",
      "qlib_name": "MA5",
      "version": "1.0.0"
    },
    {
      "expression": "Mean($close, 10)/$close",
      "implementation_fingerprint": "7f6205cc6e3c6774565051e8e9eb17d509f7bd0e9a332e56a0bfec387e4c4043",
      "minimum_history": 60,
      "name": "qlib_ma10",
      "qlib_name": "MA10",
      "version": "1.0.0"
    },
    {
      "expression": "Mean($close, 20)/$close",
      "implementation_fingerprint": "ef578a5c0531a42bdb42a924d891ab9293d99f9b8f63ca2d9aa18f58b75145d0",
      "minimum_history": 60,
      "name": "qlib_ma20",
      "qlib_name": "MA20",
      "version": "1.0.0"
    },
    {
      "expression": "Mean($close, 30)/$close",
      "implementation_fingerprint": "d810a20775fc78bc2888844b55de043282364ff54d80961a8f78739c6a63df6e",
      "minimum_history": 60,
      "name": "qlib_ma30",
      "qlib_name": "MA30",
      "version": "1.0.0"
    },
    {
      "expression": "Mean($close, 60)/$close",
      "implementation_fingerprint": "012bfcb83a6b59866b07e1c108aa374e30f9d7ad10609086f505ad085414c63c",
      "minimum_history": 60,
      "name": "qlib_ma60",
      "qlib_name": "MA60",
      "version": "1.0.0"
    },
    {
      "expression": "Std($close, 5)/$close",
      "implementation_fingerprint": "0416e62ac6094827379ca0cc2bee2968c4569af9663a437058c9f384d4e3afb1",
      "minimum_history": 60,
      "name": "qlib_std5",
      "qlib_name": "STD5",
      "version": "1.0.0"
    },
    {
      "expression": "Std($close, 10)/$close",
      "implementation_fingerprint": "e7b75c89ef62c61fb0d26d2689e15e0a42b984d98ed75b0312c782aeeefb378a",
      "minimum_history": 60,
      "name": "qlib_std10",
      "qlib_name": "STD10",
      "version": "1.0.0"
    },
    {
      "expression": "Std($close, 20)/$close",
      "implementation_fingerprint": "65b272da890b4976d424fa8d68de45d1274edc57d32f7042012a15850da4a383",
      "minimum_history": 60,
      "name": "qlib_std20",
      "qlib_name": "STD20",
      "version": "1.0.0"
    },
    {
      "expression": "Std($close, 30)/$close",
      "implementation_fingerprint": "890a7383cbff9396d401be4628e343412914bc311ca1086801991ddfe87a9e28",
      "minimum_history": 60,
      "name": "qlib_std30",
      "qlib_name": "STD30",
      "version": "1.0.0"
    },
    {
      "expression": "Std($close, 60)/$close",
      "implementation_fingerprint": "225a9e0c67b719ee2aea76c703d77996576a19dd474848d43cb02a466d3c5f17",
      "minimum_history": 60,
      "name": "qlib_std60",
      "qlib_name": "STD60",
      "version": "1.0.0"
    },
    {
      "expression": "Slope($close, 5)/$close",
      "implementation_fingerprint": "96f5722b5771c977a028dca3e039c99351759bd0dbefbfee4f5807d3ce6eb29a",
      "minimum_history": 60,
      "name": "qlib_beta5",
      "qlib_name": "BETA5",
      "version": "1.0.0"
    },
    {
      "expression": "Slope($close, 10)/$close",
      "implementation_fingerprint": "aca8c22971702ac66431822a266cd26142e2f79e97cb5e74b29d68d039680034",
      "minimum_history": 60,
      "name": "qlib_beta10",
      "qlib_name": "BETA10",
      "version": "1.0.0"
    },
    {
      "expression": "Slope($close, 20)/$close",
      "implementation_fingerprint": "2c189d7c66ab3e75eeaaef886f4eba4a550e9cb27ec95bf985eecfdc5bbc61a8",
      "minimum_history": 60,
      "name": "qlib_beta20",
      "qlib_name": "BETA20",
      "version": "1.0.0"
    },
    {
      "expression": "Slope($close, 30)/$close",
      "implementation_fingerprint": "186888da71a57858dc43dfe6ce7be3a02cfdff7a622ffe536daee47f2a8190c2",
      "minimum_history": 60,
      "name": "qlib_beta30",
      "qlib_name": "BETA30",
      "version": "1.0.0"
    },
    {
      "expression": "Slope($close, 60)/$close",
      "implementation_fingerprint": "5c281f03c35e33f9f701e759a69cd2d62ac11f2a00a0f5bc1ceaf3606a9af077",
      "minimum_history": 60,
      "name": "qlib_beta60",
      "qlib_name": "BETA60",
      "version": "1.0.0"
    },
    {
      "expression": "Rsquare($close, 5)",
      "implementation_fingerprint": "11c4afdbb10e0577e23aba7135ac99ccf8023b7260ce01cbcffe517b867b5673",
      "minimum_history": 60,
      "name": "qlib_rsqr5",
      "qlib_name": "RSQR5",
      "version": "1.0.0"
    },
    {
      "expression": "Rsquare($close, 10)",
      "implementation_fingerprint": "4ac425e9a5a1dc5479494dc1a6deb658609d92f348a7d4353ed91cf026b257c3",
      "minimum_history": 60,
      "name": "qlib_rsqr10",
      "qlib_name": "RSQR10",
      "version": "1.0.0"
    },
    {
      "expression": "Rsquare($close, 20)",
      "implementation_fingerprint": "3ade0a701e3e70a50215585c6f60f084bcf5df4d0ff5d076e4bd22b329ee0560",
      "minimum_history": 60,
      "name": "qlib_rsqr20",
      "qlib_name": "RSQR20",
      "version": "1.0.0"
    },
    {
      "expression": "Rsquare($close, 30)",
      "implementation_fingerprint": "b742846980e2d4acd559106bd32b81266edb8e085401ff68bec4f43a169b41bd",
      "minimum_history": 60,